{"accountId":"00000000011","customer":{"customerId":"000000011","firstName":"Hayden","middleName":"Ressie","lastName":"Pfannerstill","addressLine1":"14895 Everette Ridges","addressLine2":"Apt. 443","addressLine3":"Julianneburgh","stateCode":"WA","countryCode":"USA","zip":"24984","phone1":"(002)533-6980","phone2":"(553)586-7718","ficoScore":209},"account":{"activeStatus":"Y","currentBalance":212.00,"creditLimit":4998.00,"cashCreditLimit":3175.00,"openDate":"2014-09-12","expirationDate":"2025-03-12","reissueDate":"2025-03-12","currentCycleCredit":0.00,"currentCycleDebit":0.00,"groupId":"A"},"cards":[{"cardNumber":"7427684863423209"}],"transactions":[{"transactionId":"0000000196728331","cardNumber":"7427684863423209","typeCode":"03","categoryCode":"0001","source":"OPERATOR","description":"Return item at Hane and Sons","amount":-744.77,"merchantId":"800000000","merchantName":"Hane and Sons","merchantCity":"Erdmanberg","merchantZip":"80151","originTimestamp":"2022-06-10 19:27:53.000000","processTimestamp":""},{"transactionId":"0000000232640164","cardNumber":"7427684863423209","typeCode":"01","categoryCode":"0001","source":"POS TERM","description":"Purchase at Blick LLC","amount":160.99,"merchantId":"800000000","merchantName":"Blick LLC","merchantCity":"East Ali","merchantZip":"23808","originTimestamp":"2022-06-10 19:27:53.000000","processTimestamp":""},{"transactionId":"0000000361866674","cardNumber":"7427684863423209","typeCode":"01","categoryCode":"0001","source":"POS TERM","description":"Purchase at Mayer and Daughters","amount":446.00,"merchantId":"800000000","merchantName":"Mayer and Daughters","merchantCity":"North Keeley","merchantZip":"40519","originTimestamp":"2022-06-10 19:27:53.000000","processTimestamp":""},{"transactionId":"0000000577165878","cardNumber":"7427684863423209","typeCode":"01","categoryCode":"0001","source":"POS TERM","description":"Purchase at Macejkovic-Mohr","amount":621.22,"merchantId":"800000000","merchantName":"Macejkovic-Mohr","merchantCity":"Trantowberg","merchantZip":"59291","originTimestamp":"2022-06-10 19:27:53.000000","processTimestamp":""},{"transactionId":"0000000673250360","cardNumber":"7427684863423209","typeCode":"01","categoryCode":"0001","source":"POS TERM","description":"Purchase at Ebert-Gleason","amount":191.00,"merchantId":"800000000","merchantName":"Ebert-Gleason","merchantCity":"Altenwerthbury","merchantZip":"89085","originTimestamp":"2022-06-10 19:27:53.000000","processTimestamp":""},{"transactionId":"0000000751696292","cardNumber":"7427684863423209","typeCode":"01","categoryCode":"0001","source":"POS TERM","description":"Purchase at Smith, Hansen and Waelchi","amount":653.55,"merchantId":"800000000","merchantName":"Smith, Hansen and Waelchi","merchantCity":"Jerrodport","merchantZip":"37182-0090","originTimestamp":"2022-06-10 19:27:53.000000","processTimestamp":""}]}
