{
  "accountId": "00000000011",
  "customer": {
    "customerId": "000000101",
    "firstName": "Morgan",
    "middleName": "Lee",
    "lastName": "Harper",
    "addressLine1": "18 Market Street",
    "addressLine2": "Apt 4B",
    "addressLine3": "",
    "stateCode": "IL",
    "countryCode": "USA",
    "zip": "60601",
    "phone1": "312-555-0182",
    "phone2": "",
    "ficoScore": 742
  },
  "account": {
    "activeStatus": "Y",
    "currentBalance": 1284.37,
    "creditLimit": 7500.00,
    "cashCreditLimit": 1500.00,
    "openDate": "2021-04-15",
    "expirationDate": "2027-04-30",
    "reissueDate": "2027-03-15",
    "currentCycleCredit": 125.00,
    "currentCycleDebit": 1489.37,
    "groupId": "STANDARD-01"
  },
  "cards": [
    { "cardNumber": "4111111111111111" },
    { "cardNumber": "5555555555554444" }
  ],
  "transactions": [
    { "transactionId": "000000001", "cardNumber": "4111111111111111", "typeCode": "DB", "categoryCode": "5411", "source": "POS", "description": "Weekly groceries", "amount": 86.42, "merchantId": "000120001", "merchantName": "Lakeside Market", "merchantCity": "Chicago", "merchantZip": "60611", "originTimestamp": "2025-02-03 18:42:11", "processTimestamp": "2025-02-04 02:10:00" },
    { "transactionId": "000000002", "cardNumber": "4111111111111111", "typeCode": "DB", "categoryCode": "5812", "source": "POS", "description": "Dinner with friends", "amount": 64.80, "merchantId": "000120002", "merchantName": "North Pier Kitchen", "merchantCity": "Chicago", "merchantZip": "60614", "originTimestamp": "2025-02-06 20:15:32", "processTimestamp": "2025-02-07 02:10:00" },
    { "transactionId": "000000003", "cardNumber": "5555555555554444", "typeCode": "DB", "categoryCode": "5814", "source": "WEB", "description": "Coffee subscription", "amount": 18.00, "merchantId": "000120003", "merchantName": "Bean & Co.", "merchantCity": "Portland", "merchantZip": "97205", "originTimestamp": "2025-02-08 09:01:05", "processTimestamp": "2025-02-09 02:10:00" },
    { "transactionId": "000000004", "cardNumber": "4111111111111111", "typeCode": "DB", "categoryCode": "5541", "source": "POS", "description": "Fuel purchase", "amount": 52.17, "merchantId": "000120004", "merchantName": "City Fuel", "merchantCity": "Evanston", "merchantZip": "60201", "originTimestamp": "2025-02-10 07:33:48", "processTimestamp": "2025-02-11 02:10:00" },
    { "transactionId": "000000005", "cardNumber": "5555555555554444", "typeCode": "DB", "categoryCode": "5942", "source": "WEB", "description": "Paperback books", "amount": 43.98, "merchantId": "000120005", "merchantName": "PageTurner Books", "merchantCity": "Seattle", "merchantZip": "98101", "originTimestamp": "2025-02-12 13:25:19", "processTimestamp": "2025-02-13 02:10:00" },
    { "transactionId": "000000006", "cardNumber": "4111111111111111", "typeCode": "CR", "categoryCode": "5311", "source": "WEB", "description": "Returned jacket", "amount": -79.99, "merchantId": "000120006", "merchantName": "Harbor Outfitters", "merchantCity": "Chicago", "merchantZip": "60607", "originTimestamp": "2025-02-14 16:40:10", "processTimestamp": "2025-02-15 02:10:00" },
    { "transactionId": "000000007", "cardNumber": "5555555555554444", "typeCode": "DB", "categoryCode": "4899", "source": "WEB", "description": "Internet service", "amount": 79.00, "merchantId": "000120007", "merchantName": "MetroNet", "merchantCity": "Chicago", "merchantZip": "60601", "originTimestamp": "2025-02-16 00:01:00", "processTimestamp": "2025-02-16 02:10:00" },
    { "transactionId": "000000008", "cardNumber": "4111111111111111", "typeCode": "CR", "categoryCode": "5812", "source": "WEB", "description": "Restaurant refund", "amount": -24.50, "merchantId": "000120002", "merchantName": "North Pier Kitchen", "merchantCity": "Chicago", "merchantZip": "60614", "originTimestamp": "2025-02-18 11:09:44", "processTimestamp": "2025-02-19 02:10:00" },
    { "transactionId": "000000009", "cardNumber": "5555555555554444", "typeCode": "DB", "categoryCode": "5912", "source": "POS", "description": "Pharmacy essentials", "amount": 31.49, "merchantId": "000120008", "merchantName": "Wellness Pharmacy", "merchantCity": "Chicago", "merchantZip": "60610", "originTimestamp": "2025-02-20 17:22:07", "processTimestamp": "2025-02-21 02:10:00" }
  ]
}
